4,Beca Lyne-Pirkis,Beca,Lyne-Pirkis,Beca,31 years,Military Wives' Choir Singer,"Aldershot, Hampshire",NA,0,1,3,6,1,11,5,0,0,9,90,33.333333333333336,2013-08-20,2013-10-15,2014-12-28,2015-02-22,28-Dec-14,22-Feb-15,IN,Chocolate Cherry Indulgence,Grapefruit Sandwich Cake,8,IN,"Five Strand Christmas Wreath (Sultanas, Cinnamon and Honey)",Fennel and Chilli Breadsticks,11,IN,Limoncello and Blueberry BurstsMillionaire Shortbread,Orange and Ginger Trifle,10,IN,Moroccan Vegetable Filo Feast,Mamgu's Cherry-Apple Tart,2,IN,Tiered Macaron and Sugar Dough Biscuit Centrepiece,"Chocolate, Cherry and Hazelnut Brownies",5,IN,"Chocolate and Rum-Soaked Prune Brioches
Cardamom Spiced Lemon Iced Buns",Bara Brith,6,IN,"Nectarine and Frangipane Squares
Chocolate and Hazelnut Vol-au-vents
Strawberries and Cream Mille-feuille","Spring Lamb and Vegetable Suet Pudding
with Redcurrant Gravy",1,IN,Spiced Butternut Squash and Pecan 'Cheese' Cake,"Potato, Spelt and Rosemary Focaccia",4,OUT,Banoffee Opera Cake,"Stilton and Walnut Macarons
Beetroot and Salmon Choux PuffsWelsh Rarebit Tartlets",3,NA,NA,NA,NA
4,Christine Wallace,Christine,Wallace,Christine,66 years,Director of an engraving company,"Didcot, Oxfordshire",NA,2,1,2,6,1,7,4,0,0,8,80,25,2013-08-20,2013-10-08,2014-12-28,2015-02-15,28-Dec-14,15-Feb-15,IN,Chocolate and Orange 'Fripperous' Hat Cake,"Strawberry, Vanilla and Rosewater Summer Basket",3,IN,"Double Plaited Loaf (Onion, Cheese, and Bacon)",Mediterranean Breadsticks with Oregano,4,SB,Ninety-NinersSachertorte Parcels,Caribbean Pina Colada Trifle,4,IN,Roasted Vegetable Filo Pie with Feta Cheese,"Granny Rogers' Apple, Plum & Cinnamon Country Pie",7,SB,Shortbread Bavarian Clock Tower,Mixed Berry and Almond Crumble Traybake,1,IN,"Schnecken Buns
Vanilla Custard Skolebrød",Oxford Nutty Fruit Loaf,4,IN,"Eccles Cakes
Fresh Fruit Baskets
Lemon Cream Eton Mess Mille-feuille","Spotted Dick 'With a Kick'
and Vanilla Custard Ice Cream",6,OUT,Sweet Potato Guitar with Passion Fruit Icing and Marshmallow Fondant,"Multi-Seeded Loaf with Pumpkin, Sesame and Sunflower Seeds",5,NA,NA,NA,NA,NA,NA,NA,NA
4,Deborah Manger,Deborah,Manger,Deborah,51 years,Dentist,Peterborough,NA,0,0,0,3,8,9,9,0,0,3,30,0,2013-08-20,2013-09-03,2014-12-28,2015-01-11,28-Dec-14,11-Jan-15,IN,'Coffee Time',Pineapple Cake,9,IN,Walnut Fleur Loaf,Fennel & Chilli Breadsticks,8,OUT,"Canelé Cherry and Chocolate Cakes
Rose Cookies",Tropical Trifle*,9,NA,NA,NA,NA,NA,NA,NA,NA,NA,NA,NA,NA,NA,NA,NA,NA,NA,NA,NA,NA,NA,NA,NA,NA,NA,NA,NA,NA
4,Frances Quinn,Frances,Quinn,Frances,31 years,Children's Clothes Designer,"Market Harborough, Leicestershire",WINNER,1,1,7,3,1,8,3,1,0,10,100,70,2013-08-20,2013-10-22,2014-12-28,2015-03-01,28-Dec-14,1-Mar-15,IN,Secret Squirrel Cake,Giant Jam Sandwich,7,IN,Sailor's Knot,Giant Matchsticks,2,IN,'Ballet Bites' Ginger NutcrackersSugar Plum Fairy Cakes,Apple and Blackberry Crumble Trifle,8,IN,Cherry Tree Baklava Filo Pie,Peach Pie In the Sky,1,IN,Biscuit Buttons and Beads,Millionaire Banoffee Bonus,3,IN,"Hot Cross Brioches
Rhubarb and Custard Kolaches",Chai Tea Loaf,2,SB,"French Framboise Cream Horns
Sheet Music Mille-feuille
Bass Clef Palmiers","Figgy Roll-y Poly Pudding
with Caramelised Walnut and Honey Ice-Cream",5,IN,"Hidden Carrot Cake (Ground Praline, Beetroot and Walnut)",'Chelsea Flour Show' Bun Bouquet,3,IN,Great British Soap Opera Cake,"Legume Canapés:
Chantenay Carrots
Choux Pastry Tomatoes
Cauliflower Cheese Scones",2,WINNER,Midsummer Night's Dream Wedding Cake,Rainbow Picnic Pie,3
4,Glenn Cosby,Glenn,Cosby,Glenn,37 years,English Teacher,"Teignmouth, Devon",NA,0,1,3,4,1,9,4,0,0,7,70,42.857142857142854,2013-08-20,2013-10-01,2014-12-28,2015-02-08,28-Dec-14,8-Feb-15,IN,Almond and Espresso Chocolate Cake,Strawberries and Cream Cake,4,IN,Harvest Crown,Rosemary and Parmesan Grissini,7,IN,"Billionaire Bouchées
Orange Financiers",Raspberry and Almond Trifle,1,IN,Spanakopita (Walnut and Feta Cheese),Apple & Maple Syrup Pie,9,IN,Shortbread and Macaron Helter-Skelter,Apricot and Pistachio Tiffin,2,IN,"Almond and Apricot Brioches
Sticky Caramel Kanelbullen",Devonshire Panettone,5,OUT,"Caramelised Apple and Marzipan Tartlets
Chocolate Elephant EarsPassion Fruit Mille-feuille","Prune and Armagnac Pudding
with Boozy Butterscotch Sauce",3,NA,NA,NA,NA,NA,NA,NA,NA,NA,NA,NA,NA
4,Howard Middleton,Howard,Middleton,Howard,51 years,Council Worker,Sheffield,NA,0,0,0,6,5,10,7,0,0,6,60,0,2013-08-20,2013-09-24,2014-12-28,2015-02-01,28-Dec-14,1-Feb-15,IN,Black Forest Revisited,Passion Fruit and Coconut Cake,6,IN,Picasso Sun Bread (Oregano and Orange Zest),Moroccan Breadsticks,10,IN,"Black Coffee and Cardamom Cakes
White Stilton and Pear Biscuits",Caramel and Apple Trifle*,7,IN,Fresh Fig and Feta Filo Flan,Apple Pie with Sage Pastry,5,IN,Japanese Pagoda Tea Tower,Breakfast Traybake,8,OUT,"Peachy Buns
German Baumschnecken",Date & Hemp Yorkshire Loaf,7,NA,NA,NA,NA,NA,NA,NA,NA,NA,NA,NA,NA,NA,NA,NA,NA
4,Kimberley Wilson,Kimberley,Wilson,Kimberley,30 years,Psychologist,London,Runner Up,2,3,5,5,1,10,3.5,0,1,10,100,50,2013-08-20,2013-10-22,2014-12-28,2015-03-01,28-Dec-14,1-Mar-15,IN,"Chocolate, Raspberry & Basil Layer Cake",Blood Orange Cake,10,IN,Peace Bread (Za'atar Spice Mix and Garlic),Nigella Seed and Parmesan Breadsticks,1,IN,"Chocolate Pistachio Financiers
Lemon Bergamot Biscuits","Peach, Almond and Ginger Trifle",6,SB,"Chicken, Bacon and Butternut Squash Pie",Pecan and Rosemary Caramel Apple Pie,4,IN,Black and White Viennese Biscuit Stack,Cherry and Almond Bakewell Florentine Slice,7,IN,"Double Chocolate and Hazelnut Brioches
Danish Kanelsnurrer",Chai Spiced Ginger and Date Tea Loaf,3,IN,"Pear, Malt and Butterscotch Mille-feuille
Blackberry and Lemon Verbena Crème Brûle Custard Tarts
Fig, Orange and Thyme Galette","Barberry and Apple Spotted Dick
with Maple Syrup and White Chocolate Custard",4,IN,Butternut Squash and Spice Cake Toadstool House,Wild Garlic Pesto and Parma Ham Spelt Loaf,2,SB,Passion Fruit and Lime Opera Cake,"Pea Purée Tarts
Crab and Wasabi Profiteroles
Steamed Buns with Barbecue Chicken",1,RUNNER UP,Languages of Love Wedding Cake,Chicken and Pig Pie,1
4,Lucy Bellamy,Lucy,Bellamy,Lucy,38 years,Horticulturist,"Grimsby, Lincolnshire",NA,0,0,1,1,2,12,7,0,0,2,20,50,2013-08-20,2013-08-27,2014-12-28,2015-01-04,28-Dec-14,4-Jan-15,IN,Thyme 'Wildwood' Cake,Timperley Early Cake,2,OUT,Roast Tomato Bread,Grissini with Salt,12,NA,NA,NA,NA,NA,NA,NA,NA,NA,NA,NA,NA,NA,NA,NA,NA,NA,NA,NA,NA,NA,NA,NA,NA,NA,NA,NA,NA,NA,NA,NA,NA
4,Mark Onley,Mark,Onley,Mark,37 years,Carpenter & Kitchen Fitter,Milton Keynes,NA,0,0,0,3,5,11,6,0,0,3,30,0,2013-08-20,2013-09-03,2014-12-28,2015-01-11,28-Dec-14,11-Jan-15,IN,Chocolate Monster,Lemon and Poppy Seed Cake,5,IN,Sage & Garlic Plait,Rosemary & Raisin Breadsticks,6,OUT,"Rose and Pistachio Macaroons
Chocolate and Raspberry Bites","Ginger, Mango and Passion Fruit Trifle",11,NA,NA,NA,NA,NA,NA,NA,NA,NA,NA,NA,NA,NA,NA,NA,NA,NA,NA,NA,NA,NA,NA,NA,NA,NA,NA,NA,NA
4,Robert Smart,Robert,Smart,Robert,54 years,Space Satellite Designer,"Melbourn, Cambridgeshire",NA,1,1,3,2,1,5,3,0,0,5,50,60,2013-08-20,2013-09-17,2014-12-28,2015-01-25,28-Dec-14,25-Jan-15,SB,Raspberry Chocolate Cake,Pecan and Apple Cake,1,IN,Tribute Loaf,Twisty Rye Bread Sticks,5,IN,Almond FriandsTurǫn Macaroons,Rhubarb and Orange Trifle,2,IN,Spanakopita with St George's Mushrooms,Apple and Pear Pie with Thyme,3,OUT,Dalek,Blueberry & Orange Traybake,4,NA,NA,NA,NA,NA,NA,NA,NA,NA,NA,NA,NA,NA,NA,NA,NA,NA,NA,NA,NA
4,Ruby Tandoh,Ruby,Tandoh,Ruby,20 years,History of Art and Philosophy Student,"Southend, Essex",Runner Up,3,2,6,4,1,12,3,0,1,10,100,60,2013-08-20,2013-10-22,2014-12-28,2015-03-01,28-Dec-14,1-Mar-15,IN,Chocolate and Ginger Night Sky Cake,Rhubarb and Custard Sandwich Cake,12,SB,White Chocolate and Orange Peacock Bread,Mexican Breadsticks,3,IN,"Lemon Shortbread and White Chocolate Seashells
Blackberry and Chocolate Layer Cakes",Desert Island Trifle,3,IN,"Rose, Almond and Raspberry Filo Pie",Apple and Marzipan Pie,6,IN,'Dropped Ice-Cream' Biscuit Centrepiece,Blackberry and Lemon Bakewell Slice,6,SB,"Twisted Swedish Kanelbullar
Saffron St. Lucia Buns",Citrus Tea Loaf,1,IN,"Raspberry and Passion Fruit Mille-feuille
Caramelised Apple Lattice
Portuguese Custard Tarts","Plum Jam Roly-Poly
with Ginger Ice cream",2,SB,Carrot Cake and Pistachio Garden Plot,Mango and Nigella Seed Spelt Cob,1,IN,"Chocolate, Almond Praline and Saffron Opera Cake","Beetroot Jelly on Poppy Seed Biscuits
Spinach, Parmesan and Egg Tartlets
Choux Buns with Goat's Cheese and Caramelised Onions",4,RUNNER UP,"Raspberry, Lemon and Passion Fruit Wedding Cake",Picnic Basket Pie,2
4,Toby Waterworth,Toby,Waterworth,Toby,30 years,Web Programmer,"Reading, Berkshire",NA,0,0,0,1,13,13,13,0,0,1,10,0,2013-08-20,2013-08-20,2014-12-28,2014-12-28,28-Dec-14,28-Dec-14,OUT,Two Tiered Chocolate Cake,Spiced and Iced Carrot Cake,13,NA,NA,NA,NA,NA,NA,NA,NA,NA,NA,NA,NA,NA,NA,NA,NA,NA,NA,NA,NA,NA,NA,NA,NA,NA,NA,NA,NA,NA,NA,NA,NA,NA,NA,NA,NA
5,Chetna Makan,Chetna,Makan,Chetna,35 years,Fashion designer,"Broadstairs, Kent",NA,1,1,5,4,1,8,3,0,0,9,90,55.55555555555556,2014-08-06,2014-10-01,2015-09-06,2015-11-01,6-Sep-15,1-Nov-15,IN,Tiered Victoria Sponges with Lemon Curd and Raspberry Cream,"Cardamom, Pistachio and Coffee Swiss Roll",3,IN,Day On The Beach,Fenugreek and Carom Crackers,8,IN,Rolled and Filled Twin Loaf,Onion and Pine Nut Rolls,8,IN,"Mango, Raspberry and Coconut Baked Alaska","Rhubarb, Strawberry and Orange Puddings",3,IN,Fusion Tiered Pies,Rice Custard Tart with Mangoes and Raspberries,2,SB,Almond Liqueur Dobos Torte with Chocolate Caramel Buttercream,Orange Savarin with Cinnamon Cream,2,IN,Chocolate and Mango & Lemon Meringue Éclairs,Crispy Lentil Kachori,6,IN,Chocolate Mousse Filled DoughnutsBraided Doughnuts,Date and Walnut Swirl Bread,1,OUT,"Chocolate, Orange and Nut Entremets
Cappuccino Entremets",Chocolate and Orange BaklavaMasala Chai Baklava,4,NA,NA,NA,NA
5,Claire Goodwin,Claire,Goodwin,Claire,31 years,Speech therapist,"Ashton on Mersey, Trafford",NA,0,0,0,1,8,8,8,0,0,1,10,0,2014-08-06,2014-08-06,2015-09-06,2015-09-06,6-Sep-15,6-Sep-15,OUT,Mini Chocolate and Cherry Cakes,Chocolatey Orangey Swirly Roll,8,NA,NA,NA,NA,NA,NA,NA,NA,NA,NA,NA,NA,NA,NA,NA,NA,NA,NA,NA,NA,NA,NA,NA,NA,NA,NA,NA,NA,NA,NA,NA,NA,NA,NA,NA,NA
5,Diana Beard,Diana,Beard,Diana,69 years,Women's Institute (WI) judge,"Alkington, Shropshire",NA,0,0,0,4,5,9,7,0,0,5,50,0,2014-08-06,2014-09-03,2015-09-06,2015-10-04,6-Sep-15,4-Oct-15,IN,Chocolate Ganache Surprises,Mum's Sunday Tea Lemon Curd Swiss Roll,5,IN,"Express, First Class",Parmesan Triangles,7,IN,Sharing Savoury Pinwheel,Rustic Picnic Rolls,7,IN,Raspberry Ripple Alaska Swan,Orange and Lemon Curd Pots,9,LEFT,NA,NA,NA,NA,NA,NA,NA,NA,NA,NA,NA,NA,NA,NA,NA,NA,NA,NA,NA,NA,NA,NA,NA
5,Enwezor Nzegwu,Enwezor,Nzegwu,Enwezor,39 years,Business consultant,"Portsmouth, Hampshire",NA,0,0,0,2,9,9,9,0,0,2,20,0,2014-08-06,2014-08-13,2015-09-06,2015-09-13,6-Sep-15,13-Sep-15,IN,Coffee and Walnut Battenberg Squares,Raspberry and Lemon Swiss Roll,9,OUT,Space Adventure Moon Scene,Pumpkin and Sunflower Savoury Biscuits,9,NA,NA,NA,NA,NA,NA,NA,NA,NA,NA,NA,NA,NA,NA,NA,NA,NA,NA,NA,NA,NA,NA,NA,NA,NA,NA,NA,NA,NA,NA,NA,NA
5,Iain Watters,Iain,Watters,Iain,31 years,Construction engineer,London / Belfast,NA,0,0,0,4,4,11,7.5,0,0,4,40,0,2014-08-06,2014-08-27,2015-09-06,2015-09-27,6-Sep-15,27-Sep-15,IN,"Lemon Drizzle Cakes with Mascarpone Filling, Drizzled Icing, and Candied Lemon",Apricot and Basil Swiss Roll with Mascarpone and White Chocolate Cream,4,IN,Wild West Scene,Za'atar and Fig Biscuits,11,IN,Moroccan Plaited with a Bessara Dip,Cranberry and Walnut Rye Bread Rolls,9,OUT,"Chocolate, Black Sesame Seed and Coffee Caramel Baked Alaska (not presented)","Chocolate, Lime and Raspberry Fondants",6,NA,NA,NA,NA,NA,NA,NA,NA,NA,NA,NA,NA,NA,NA,NA,NA,NA,NA,NA,NA,NA,NA,NA,NA
5,Jordan Cox,Jordan,Cox,Jordan,32 years,IT manager,"Sneinton, Nottingham",NA,0,0,0,3,6,12,10,0,0,3,30,0,2014-08-06,2014-08-20,2015-09-06,2015-09-20,6-Sep-15,20-Sep-15,IN,Lemon Drizzle Cakes with Blueberry and Lemon Curd,Kawaii Frasier Swiss Roll,12,IN,Monster Attack,"Sourdough, Parmesan and Chilli Biscuits",6,OUT,Strawberry Raspberry Cheesecake Brioche,Rye and Spelt Bread Rolls,10,NA,NA,NA,NA,NA,NA,NA,NA,NA,NA,NA,NA,NA,NA,NA,NA,NA,NA,NA,NA,NA,NA,NA,NA,NA,NA,NA,NA
5,Kate Henry,Kate,Henry,Kate,41 years,Furniture restorer,"Brighton, East Sussex",NA,1,1,2,5,1,7,4,0,0,7,70,28.571428571428573,2014-08-06,2014-09-17,2015-09-06,2015-10-18,6-Sep-15,18-Oct-15,IN,Mini Tiered Victoria Sponges,Red Velvet and White Chocolate Swiss Roll,6,IN,Tea Time,Parmesan and Apple Biscuits,4,IN,"Prosciutto, Olive and Coriander Bread",Orange and Cardamom Rye Bread Knots,1,IN,"Pistachio, Raspberry and Chocolate Baked Alaska",Chocolate and Salted Caramel Molten Puddings,7,SB,"Rhubarb, Prune and Apple Pork Pies",Rhubarb and Custard Tart,3,IN,Trio of Dobos Tortes,"Pecan, Chocolate and Sour Cherry Yeast Cake",6,OUT,Neapolitan & Lemon Meringue Éclairs,Spinach and Paneer Spicy Samosa,4,NA,NA,NA,NA,NA,NA,NA,NA,NA,NA,NA,NA
5,Luis Troyano,Luis,Troyano,Luis,42 years,Graphic designer,"Poynton, Cheshire",Runner up,1,1,7,3,1,7,2.5,0,1,10,100,70,2014-08-06,2014-10-08,2015-09-06,2015-11-08,6-Sep-15,8-Nov-15,IN,Raspberry and Lemon Genoise Slices with Lemon Drizzles,Spanish Swiss Roll,7,IN,George Versus The Dragon,Black Olive and Rosemary Biscuits with Caramelised Onion Glaze,3,SB,Roscón de Reyes,Opposites Attract Rolls,2,IN,Bakewell Alaska,Pears in Puddings,2,IN,Four Fruity Seasons Tower,Tropical Manchester Tart,6,IN,The Cage on the Rocky Hill,Apple & Cinnamon Kugelhopf with Honeyed Apples,3,IN,"Stars and Stripes Éclairs
(Blueberry Cheesecake & Peanut Butter and Jelly Éclairs)",Childhood Empanadas,5,IN,"Cocktail Doughnuts
(Mudslide & Raspberry Mojito)",Black Forest Cherry Tree,2,IN,"Chocolate Mousse and Cherry Entremets
Pomegranate, Fig and Pistachio Sponges",Indian Rose BaklavaHalwa Baklava Rolls,1,RUNNER UP,Village in Chocolate,"Apple, Walnut, Raisin and Cheshire Cheese ChaussonsPain au Chocolat Blanc with Raspberries and Cream Cheese",2
5,Martha Collison,Martha,Collison,Martha,17 years,Student,"Ascot, Berkshire",NA,0,2,5,3,1,5,3,0,0,8,80,62.5,2014-08-06,2014-09-24,2015-09-06,2015-10-25,6-Sep-15,25-Oct-15,IN,Mini Lemon and Thyme Drizzle Cakes,Tiramisu Swiss Roll,2,IN,Ski Village Scene,Caramelised Onion and Goat's Cheese Sandwich Biscuits,5,IN,Stuffed Sunflower Loaf,Date and Walnut Rye Rolls,3,IN,Key Lime Baked Alaska,Peanut Butter Chocolate Fondants,1,IN,Three Little Pigs Pie,"Pistachio, Apricot and Honey Custard Tart",1,IN,Chess-Themed Chocolate and Salted Caramel Dobos Torte,Dark Chocolate and Almond Liqueur Savarin,4,IN,"Rhubarb and Custard Éclairs
Maple Syrup and Bacon Éclairs",Mini Beef Wellingtons,3,OUT,"Glazed Lemon and Poppy Seed Doughnuts
Chocolate and Passion Fruit Doughnuts",Spiced Plum Iced Bread Swirl,5,NA,NA,NA,NA,NA,NA,NA,NA
5,Nancy Birtwhistle,Nancy,Birtwhistle,Nancy,60 years,Retired practice manager,"Barton-Upon-Humber, Lincolnshire",WINNER,1,3,7,3,1,5,2.5,1,0,10,100,70,2014-08-06,2014-10-08,2015-09-06,2015-11-08,6-Sep-15,8-Nov-15,SB,Jaffa Orange Cakes,Coffee and Hazelnut Swiss Roll,1,IN,Hansel and Gretel Scene,Fennel and Rye Thins,2,IN,'Full English' Stromboli,Cider and Walnut Crusty Rolls,5,IN,Summer Pudding Alaska,Pistachio Puddings with Chocolate Sauce,4,IN,Trio of Apple Pies,Chocolate-Crusted Passion Fruit Tart,4,IN,Chocolate and Caramel Dobos Torte,Rum Punch Savarin with Coconut Cream and Tropical Fruits,1,IN,Smoked Salmon and Horseradish & Raspberry Ripple Éclairs,Spicy Duck Pasties,2,IN,"Doughnut Family Tree
(Limoncello and Almond & Milk Chocolate and Orange)",Lincolnshire Plum Braid,3,IN,"Raspberry Nonnettes
Lime and Passion Fruit Entremets","Coffee and Chocolate Baklava
Breakfast Baklava",3,WINNER,Red Windmill,"Apple and Lemon Kites
Raspberry and Almond Croissants",1
5,Norman Calder,Norman,Calder,Norman,66 years,Retired naval officer,"Portknockie, Moray",NA,0,0,0,5,4,11,8,0,0,5,50,0,2014-08-06,2014-09-03,2015-09-06,2015-10-04,6-Sep-15,4-Oct-15,IN,Almond and Raspberry Mini Cakes,Black Forest Swiss Roll,11,IN,Zulu Boats at Dawn,Farthing Biscuits,10,IN,Chicken and Roasted Vegetable Picnic Loaf,Rye Bread Rolls,4,IN,Baked Alaska with Strawberry Surprise,Mini Sticky Toffee Puddings,8,OUT,Pieful Tower,Tarte au Citron,5,NA,NA,NA,NA,NA,NA,NA,NA,NA,NA,NA,NA,NA,NA,NA,NA,NA,NA,NA,NA
5,Richard Burr,Richard,Burr,Richard,38 years,Builder,"Mill Hill, London",Runner up,5,2,4,6,1,10,4.5,0,1,10,100,40,2014-08-06,2014-10-08,2015-09-06,2015-11-08,6-Sep-15,8-Nov-15,IN,Miniature Coffee and Walnut Cakes,Pistachio and Strawberry Swiss Roll,10,SB,Pirates!,Rosemary Seeded Crackers,1,IN,Pesto Pinwheel,Rye and Cranberry Rolls,6,SB,Tiramisu Baked Alaska,Black Forest Chocolate Fondants,5,IN,Three Course Autumn Pie Feast,Fig and Orange Tart,7,IN,Sugar Forest Dobos Torte,Fruity Guglhupf with an Orange Glaze,5,SB,"Stair of Éclairs
(Lavender and Blueberry & Rose and Raspberry Éclairs)",Minted Lamb Pasties,1,SB,Rhubarb and Custard and Toffee Apple Doughnuts,Fruit Swedish Tea Ring,4,SB,"Hazelnut Mocha Entremets
Pink Grapefruit Entremets","Rose and Pistachio Baklava
Walnut and Almond Baklava",2,RUNNER UP,Mill on the Hill,"Pear Pain au Chocolat
Pain Au Lait",3
6,Alvin Magallanes,Alvin,Magallanes,Alvin,37 years,Nurse,"Bracknell, Berkshire",NA,0,0,1,5,2,9,6,0,0,6,60,16.666666666666668,2015-08-05,2015-09-09,2016-07-01,2016-07-22,1-Jul-16,22-Jul-16,IN,Black Forest Gâteau,Orange Vanilla and Fig Madeira Cake,2,IN,Gingerbread Box filled with Brandy Snaps,"Jackfruit, Pistachio and Macadamia Biscotti",6,IN,Cornucopia,"Prosciutto, Manchego and Balsamic Onion Soda Breads",4,IN,Tower of Fruits Cheesecakes,Blackberry Crème Brûlées,9,IN,"Buko Pandan, Mango and Passion Fruit Ice Cream Roll",Pineapple Upside-Down Cake,8,OUT,Smoked Salmon En Croûte and Vermouth Chicken à la King Vol-au-vents,Plum Frangipane Tart,6,NA,NA,NA,NA,NA,NA,NA,NA,NA,NA,NA,NA,NA,NA,NA,NA
6,Dorret Conway,Dorret,Conway,Dorret,53 years,Accountant,"Penwortham, Lancashire",NA,0,1,1,2,1,6,5,0,0,3,30,33.333333333333336,2015-08-05,2015-08-19,2016-07-01,2016-07-15,1-Jul-16,15-Jul-16,IN,Enchanted Forest Gâteau,Madeira Cake with Candied Lemons,5,IN,Box of Frogs,Almond and Apricot Biscotti with Amber Sugar Crystals,1,OUT,Unmade Bread,Walnut and Stilton Soda Breads,6,NA,NA,NA,NA,NA,NA,NA,NA,NA,NA,NA,NA,NA,NA,NA,NA,NA,NA,NA,NA,NA,NA,NA,NA,NA,NA,NA,NA
6,Flora Shedden,Flora,Shedden,Flora,19 years,Art gallery assistant,"Dunkeld, Perth and Kinross",NA,0,1,7,2,1,6,3,0,0,9,90,77.77777777777777,2015-08-05,2015-09-30,2016-07-01,2016-08-05,1-Jul-16,5-Aug-16,IN,Black Forest Gâteau,Blood Orange Madeira Cake,6,IN,Honey and Earl Grey Tea Box,Wedding Biscotti,2,IN,Herb Couture,Fig and Hazelnut Rye Breads,2,IN,Elderflower and Granola Cheesecakes,Rhubarb and Ginger Crème Brûlées,3,IN,Chocolate and Pear Bûche,"Pistachio, Apple and Cardamom Madeleine Cake",3,IN,Asparagus and Parma Ham and Praline and Chocolate Vol-au-vents,Apricot and Rosemary Frangipane Tart,2,IN,"Raspberry, Pomegranate and Champagne Charlotte Russe",Game Pie with Shallot and Apple Chutney,4,IN,Lime & Basil and Coconut & White Chocolate Religieuse à l'ancienne,Peach & Lemon Thyme and Smoked Almond & Butterscotch Cream Horns,3,OUT,Cocoa Carousel,Passion Fruit and Chocolate Tart,1,NA,NA,NA,NA
6,Ian Cumming,Ian,Cumming,Ian,41 years,Travel photographer,"Great Wilbraham, Cambridgeshire",Runner Up,3,1,6,4,1,8,3,0,1,10,100,60,2015-08-05,2015-10-07,2016-07-01,2016-08-12,1-Jul-16,12-Aug-16,IN,Black Forest Cherry Tree,Somewhere West of Madeira Cake,8,SB,Sandwich de la Confiture,"Orange, Rosemary and Almond Biscotti",3,SB,Flour Power,Wild Garlic Pesto Soda Breads,1,SB,Trio of Spicy and Herby Baked Cheesecakes,Pomegranate Two Ways Crème Brûlées,4,IN,Dessert Island,Honey and Flowers Cake,5,IN,Vol-au-vents Terre et Mer,Pear and Raspberry Frangipane Tart,3,IN,Victoria's Crown Charlotte Russe,Roadkill Pie,5,IN,Nun with Hidden Passions,Mont Blanc & Black Forest Gâteau Horns,2,IN,Chocolate Well,Chocolate and Bay Tart,3,RUNNER UP,Colossal Curry Carrot Cake,Elderflower and Lemon & Spiced Buns,2
6,Marie Campbell,Marie,Campbell,Marie,66 years,Retired,"Auchterarder, Perthshire",NA,1,0,1,1,3,11,7,0,0,2,20,50,2015-08-05,2015-08-12,2016-07-01,2016-07-08,1-Jul-16,8-Jul-16,SB,A Walk in the Black Forest,Zingy Citrus Madeira Cake,3,OUT,Russian Box,Biscotti Italiano,11,NA,NA,NA,NA,NA,NA,NA,NA,NA,NA,NA,NA,NA,NA,NA,NA,NA,NA,NA,NA,NA,NA,NA,NA,NA,NA,NA,NA,NA,NA,NA,NA
6,Mat Riley,Mat,Riley,Mat,37 years,Fire fighter,London,NA,1,1,1,6,1,8,6,0,0,7,70,14.285714285714286,2015-08-05,2015-09-16,2016-07-01,2016-07-29,1-Jul-16,29-Jul-16,IN,Black Forest Gateau,Gin and Tonic Madeira Cake,7,IN,Gingerbread Fire Engine,"Pistachio, Cranberry and White Chocolate Biscotti",5,IN,Curry Inspired Brighton Pavilion,"Jalapeño, Mexican Cheddar and Smoked Salt Soda Breads",8,IN,Chocolate Bar Cheesecakes,Coconut Crème Brûlées,7,IN,Raspberry and Coconut Ice Cream Roll,Sugar-Free Carrot Cake,4,SB,His 'n' Hers Vol-au-vents,Piña Colada Frangipane Tart,1,OUT,Strawberry Charlotte Russe,Raised Venison and Pigeon Pie,6,NA,NA,NA,NA,NA,NA,NA,NA,NA,NA,NA,NA
6,Nadiya Hussain,Nadiya,Hussain,Nadiya,30 years,Full-time mother,Leeds / Luton,winner,3,4,4,6,1,12,4,1,0,10,100,40,2015-08-05,2015-10-07,2016-07-01,2016-08-12,1-Jul-16,12-Aug-16,IN,Quadruple Chocolate Black Forest Gâteau,Orange and Green Cardamom Madeira Cake,12,IN,Box of Fortunes,"Coconut, Fennel and Pistachio Biscotti",9,IN,Snake Charmer's Basket,Mexican Bread with Warm Tomato Salsa,9,IN,Fizzy Pop Cheesecakes,Cinnamon Tea Crème Brûlées,8,SB,Chocolate and Strawberry Lime Ice Cream Roll,Naked Blueberry and Caraway Crunch Cake,1,IN,Bengali Korma and Clementine with Cod Vol-au-vents,"Bay Leaf, Rong Tea and Pear Tart",4,IN,Mango and Raspberry Charlotte Russe,Aromatic Raised Game Pie,1,SB,Bubble Gum and Peppermint Cream Religieuse à l'ancienne,Rose Pistachio and Mocha Hazelnut Horns,1,SB,Peacock in Nan's Door,Peanut Salted Caramel and Chocolate Tart,4,WINNER,My Big Fat British Wedding Cake,Cardamom and Almond Buns & Nutmeg and Sour Cherry Fingers,1
6,Paul Jagger,Paul,Jagger,Paul,49 years,Prison governor,"Swansea, Wales",NA,0,1,3,5,1,10,5,0,0,8,80,37.5,2015-08-05,2015-09-23,2016-07-01,2016-07-29,1-Jul-16,29-Jul-16,IN,Black Forest Chocolate Creation,"Lemon, Ginger and Caraway Seed Madeira Cake",10,IN,Memory Box,"Chocolate, Hazelnut and Fig Biscotti",10,IN,King of the Jungle,Cranberry and Orange Sweet Soda Breads,10,IN,Berry Cheesecake Tower,Almond Crème Brûlées,1,IN,Dessert Island Getaway,Carrot & Pecan Cake,2,IN,Savoury and Sweet Bouchées,Christmas Frangipane Tart,5,IN,Charlotte Rose,Not a Boaring Pie,2,OUT,Religieuse à l'ancienne,Café Tipple & Banana Crunch-away Horns,5,NA,NA,NA,NA,NA,NA,NA,NA
6,Sandy Docherty,Sandy,Docherty,Sandy,49 years,Child welfare officer,"Yeadon, West Yorkshire",NA,0,0,0,4,4,9,6.5,0,0,4,40,0,2015-08-05,2015-08-26,2016-07-01,2016-07-15,1-Jul-16,15-Jul-16,IN,Black Forest Gâteau,Madeira Cake with Almond Liqueur and Chopped Apricots,9,IN,Sundried Tomato Cheese Biscuit Box,Chocolate Chunk and Hazelnut Biscotti,4,IN,Basket of Bread Flowers with a Walnut and Blue Cheese Centre,Soda Breads with Smoked Bacon and Onion,7,OUT,"Cassata, Whisky and Orange & Apple Pie Cheesecakes",Pontefract Crème Brûlées,6,NA,NA,NA,NA,NA,NA,NA,NA,NA,NA,NA,NA,NA,NA,NA,NA,NA,NA,NA,NA,NA,NA,NA,NA
6,Stu Henshall,Stu,Henshall,Stu,35 years,Professional musician,"Guildford, Surrey",NA,0,0,0,1,11,11,11,0,0,1,10,0,2015-08-05,2015-08-05,2016-07-01,2016-07-01,1-Jul-16,1-Jul-16,OUT,Purple Forest Gâteau,Marley Madeira Cake,11,NA,NA,NA,NA,NA,NA,NA,NA,NA,NA,NA,NA,NA,NA,NA,NA,NA,NA,NA,NA,NA,NA,NA,NA,NA,NA,NA,NA,NA,NA,NA,NA,NA,NA,NA,NA
6,Tamal Ray,Tamal,Ray,Tamal,29 years,Trainee anaesthetist,Manchester,Runner Up,1,0,4,6,2,8,4,0,1,10,100,40,2015-08-05,2015-10-07,2016-07-01,2016-08-12,1-Jul-16,12-Aug-16,IN,Black Forest Gâteau in a Chocolate Shell,Pistachio and Rose Madeira Cake,4,IN,Chessboard Box,"Cinnamon, Maple and Cranberry Biscotti",8,IN,Breadcycle,"Fig, Cheese and Walnut Breads",3,IN,"Mango, Hazelnut and Rosemary Cheesecake Trio",Rhubarb and Ginger Crème Brûlées,5,IN,Passion Fruit and Pineapple Ice Cream Roll,Honey and Grapefruit Polenta Cake,7,IN,Fennel and Rosemary Pulled Pork and Chicken and Coriander Vol-au-vents,Spiced Pear Frangipane Tart,7,SB,"Spiced Blackberry, Raspberry and Cardamom Charlotte Russe",Middle Eastern Game Pie,3,IN,Passionfruit & Mango and Pistachio & Raspberry Religieuse à l'ancienne,Lime & Mascarpone and Malt Cream Horns,4,IN,Chocolate Bell Tower,Chocolate New York Pie,2,RUNNER UP,Sticky Toffee Pudding Cake,Cinnamon and Apple & Toffee and Marmalade Iced Buns,3
6,Ugnė Bubnaityte,Ugnė,Bubnaityte,Ugnė,32 years,PA and administrator,"Woodford, London",NA,0,1,2,3,1,7,5,0,0,5,50,40,2015-08-05,2015-09-02,2016-07-01,2016-07-22,1-Jul-16,22-Jul-16,IN,Falling Cup Gâteau,Lemon and Thyme Madeira Cake,1,IN,Baby Climbing into the Cookie Box,White Wine Biscotti,7,IN,Easter Basket,Chocolate Quick Breads with Salted Caramel Sauce,5,IN,"Lime, Coconut and Hazelnut Cheesecakes",Marula Fruit and Coffee Liqueur Crème Brûlées,2,OUT,"Chocolate, Peanut Butter and Grape Jam Roll",Chocolate and Hazelnut Sugar-Free Cake,6,NA,NA,NA,NA,NA,NA,NA,NA,NA,NA,NA,NA,NA,NA,NA,NA,NA,NA,NA,NA
